{
  "version": "compute-topology/v1",
  "generated_at": "2026-03-27T12:00:00+08:00",
  "metric_windows": [
    "5s",
    "1m",
    "5m"
  ],
  "nodes": [
    {
      "id": "cloud-hz-03",
      "kind": "compute",
      "layer": "cloud",
      "status": "up",
      "labels": {
        "name": "Cloud Compute HZ-03",
        "region": "cn-east",
        "zone": "hangzhou-a"
      },
      "capacity": {
        "cpu_cores": 128,
        "gpu_count": 8,
        "memory_gb": 1024
      },
      "metrics": {
        "ts": "2026-03-27T11:59:55+08:00",
        "load_pct": 63,
        "cpu_pct": 61,
        "gpu_pct": 68,
        "mem_pct": 59
      }
    },
    {
      "id": "cloud-bj-01",
      "kind": "compute",
      "layer": "cloud",
      "status": "up",
      "labels": {
        "name": "Cloud Compute BJ-01",
        "region": "cn-north",
        "zone": "beijing-b"
      },
      "capacity": {
        "cpu_cores": 96,
        "gpu_count": 4,
        "memory_gb": 768
      },
      "metrics": {
        "ts": "2026-03-27T11:59:55+08:00",
        "load_pct": 57,
        "cpu_pct": 56,
        "gpu_pct": 49,
        "mem_pct": 60
      }
    },
    {
      "id": "cloud-sh-01",
      "kind": "service",
      "layer": "cloud",
      "status": "up",
      "labels": {
        "name": "Discovery Service SH-01",
        "region": "cn-east",
        "zone": "shanghai-a"
      },
      "capacity": {
        "cpu_cores": 48,
        "gpu_count": 0,
        "memory_gb": 256
      },
      "metrics": {
        "ts": "2026-03-27T11:59:55+08:00",
        "load_pct": 42,
        "cpu_pct": 44,
        "gpu_pct": 0,
        "mem_pct": 51
      }
    },
    {
      "id": "cloud-cn-registry",
      "kind": "service",
      "layer": "cloud",
      "status": "up",
      "labels": {
        "name": "Global Registry",
        "region": "cn-central",
        "zone": "wuhan-a"
      },
      "capacity": {
        "cpu_cores": 32,
        "gpu_count": 0,
        "memory_gb": 128
      },
      "metrics": {
        "ts": "2026-03-27T11:59:55+08:00",
        "load_pct": 35,
        "cpu_pct": 37,
        "gpu_pct": 0,
        "mem_pct": 40
      }
    },
    {
      "id": "edge-bj-01",
      "kind": "compute",
      "layer": "edge",
      "status": "up",
      "labels": {
        "name": "Edge Compute BJ-01",
        "region": "cn-north",
        "zone": "beijing-edge-a"
      },
      "capacity": {
        "cpu_cores": 32,
        "gpu_count": 1,
        "memory_gb": 128
      },
      "metrics": {
        "ts": "2026-03-27T11:59:55+08:00",
        "load_pct": 71,
        "cpu_pct": 69,
        "gpu_pct": 77,
        "mem_pct": 66
      }
    },
    {
      "id": "edge-bj-02",
      "kind": "compute",
      "layer": "edge",
      "status": "degraded",
      "labels": {
        "name": "Edge Compute BJ-02",
        "region": "cn-north",
        "zone": "beijing-edge-b"
      },
      "capacity": {
        "cpu_cores": 24,
        "gpu_count": 1,
        "memory_gb": 96
      },
      "metrics": {
        "ts": "2026-03-27T11:59:55+08:00",
        "load_pct": 86,
        "cpu_pct": 89,
        "gpu_pct": 82,
        "mem_pct": 79
      }
    },
    {
      "id": "edge-sh-01",
      "kind": "compute",
      "layer": "edge",
      "status": "up",
      "labels": {
        "name": "Edge Compute SH-01",
        "region": "cn-east",
        "zone": "shanghai-edge-a"
      },
      "capacity": {
        "cpu_cores": 28,
        "gpu_count": 1,
        "memory_gb": 96
      },
      "metrics": {
        "ts": "2026-03-27T11:59:55+08:00",
        "load_pct": 64,
        "cpu_pct": 61,
        "gpu_pct": 66,
        "mem_pct": 58
      }
    },
    {
      "id": "edge-gz-01",
      "kind": "compute",
      "layer": "edge",
      "status": "down",
      "labels": {
        "name": "Edge Compute GZ-01",
        "region": "cn-south",
        "zone": "guangzhou-edge-a"
      },
      "capacity": {
        "cpu_cores": 24,
        "gpu_count": 1,
        "memory_gb": 64
      },
      "metrics": {
        "ts": "2026-03-27T11:59:55+08:00",
        "load_pct": null,
        "cpu_pct": null,
        "gpu_pct": null,
        "mem_pct": null
      }
    },
    {
      "id": "gw-bj-01",
      "kind": "gateway",
      "layer": "edge",
      "status": "up",
      "labels": {
        "name": "Gateway BJ-01",
        "region": "cn-north",
        "zone": "beijing-gw"
      },
      "capacity": {
        "cpu_cores": 16,
        "gpu_count": 0,
        "memory_gb": 32
      },
      "metrics": {
        "ts": "2026-03-27T11:59:55+08:00",
        "load_pct": 54,
        "cpu_pct": 51,
        "gpu_pct": 0,
        "mem_pct": 49
      }
    },
    {
      "id": "gw-sh-01",
      "kind": "gateway",
      "layer": "edge",
      "status": "up",
      "labels": {
        "name": "Gateway SH-01",
        "region": "cn-east",
        "zone": "shanghai-gw"
      },
      "capacity": {
        "cpu_cores": 16,
        "gpu_count": 0,
        "memory_gb": 32
      },
      "metrics": {
        "ts": "2026-03-27T11:59:55+08:00",
        "load_pct": 47,
        "cpu_pct": 44,
        "gpu_pct": 0,
        "mem_pct": 46
      }
    },
    {
      "id": "terminal-phone-01",
      "kind": "terminal",
      "layer": "terminal",
      "status": "up",
      "labels": {
        "name": "Terminal Phone 01",
        "region": "cn-north",
        "zone": "beijing-user"
      },
      "capacity": {
        "cpu_cores": 8,
        "gpu_count": 0,
        "memory_gb": 6
      },
      "metrics": {
        "ts": "2026-03-27T11:59:55+08:00",
        "load_pct": 33,
        "cpu_pct": 31,
        "gpu_pct": 0,
        "mem_pct": 52
      }
    },
    {
      "id": "terminal-desktop-01",
      "kind": "terminal",
      "layer": "terminal",
      "status": "up",
      "labels": {
        "name": "Terminal Desktop 01",
        "region": "cn-east",
        "zone": "shanghai-user"
      },
      "capacity": {
        "cpu_cores": 12,
        "gpu_count": 1,
        "memory_gb": 16
      },
      "metrics": {
        "ts": "2026-03-27T11:59:55+08:00",
        "load_pct": 38,
        "cpu_pct": 35,
        "gpu_pct": 19,
        "mem_pct": 41
      }
    }
  ],
  "edges": [
    {
      "id": "e-terminal-phone-01-gw-bj-01",
      "source": "terminal-phone-01",
      "target": "gw-bj-01",
      "relation": "network_link",
      "status": "up",
      "metrics": {
        "ts": "2026-03-27T11:59:55+08:00",
        "latency_ms": 12,
        "bandwidth_mbps": 80,
        "utilization_pct": 34,
        "packet_loss_pct": 0.2,
        "jitter_ms": 1.6
      }
    },
    {
      "id": "e-gw-bj-01-terminal-phone-01",
      "source": "gw-bj-01",
      "target": "terminal-phone-01",
      "relation": "network_link",
      "status": "up",
      "metrics": {
        "ts": "2026-03-27T11:59:55+08:00",
        "latency_ms": 10,
        "bandwidth_mbps": 120,
        "utilization_pct": 28,
        "packet_loss_pct": 0.1,
        "jitter_ms": 1.2
      }
    },
    {
      "id": "e-terminal-desktop-01-gw-sh-01",
      "source": "terminal-desktop-01",
      "target": "gw-sh-01",
      "relation": "network_link",
      "status": "up",
      "metrics": {
        "ts": "2026-03-27T11:59:55+08:00",
        "latency_ms": 9,
        "bandwidth_mbps": 300,
        "utilization_pct": 25,
        "packet_loss_pct": 0.05,
        "jitter_ms": 0.9
      }
    },
    {
      "id": "e-gw-sh-01-terminal-desktop-01",
      "source": "gw-sh-01",
      "target": "terminal-desktop-01",
      "relation": "network_link",
      "status": "up",
      "metrics": {
        "ts": "2026-03-27T11:59:55+08:00",
        "latency_ms": 8,
        "bandwidth_mbps": 600,
        "utilization_pct": 22,
        "packet_loss_pct": 0.03,
        "jitter_ms": 0.7
      }
    },
    {
      "id": "e-gw-bj-01-edge-bj-01",
      "source": "gw-bj-01",
      "target": "edge-bj-01",
      "relation": "network_link",
      "status": "up",
      "metrics": {
        "ts": "2026-03-27T11:59:55+08:00",
        "latency_ms": 5,
        "bandwidth_mbps": 2000,
        "utilization_pct": 49,
        "packet_loss_pct": 0.02,
        "jitter_ms": 0.4
      }
    },
    {
      "id": "e-edge-bj-01-gw-bj-01",
      "source": "edge-bj-01",
      "target": "gw-bj-01",
      "relation": "network_link",
      "status": "up",
      "metrics": {
        "ts": "2026-03-27T11:59:55+08:00",
        "latency_ms": 4,
        "bandwidth_mbps": 2200,
        "utilization_pct": 44,
        "packet_loss_pct": 0.01,
        "jitter_ms": 0.3
      }
    },
    {
      "id": "e-gw-bj-01-edge-bj-02",
      "source": "gw-bj-01",
      "target": "edge-bj-02",
      "relation": "network_link",
      "status": "degraded",
      "metrics": {
        "ts": "2026-03-27T11:59:55+08:00",
        "latency_ms": 18,
        "bandwidth_mbps": 900,
        "utilization_pct": 86,
        "packet_loss_pct": 1.1,
        "jitter_ms": 3.2
      }
    },
    {
      "id": "e-edge-bj-02-gw-bj-01",
      "source": "edge-bj-02",
      "target": "gw-bj-01",
      "relation": "network_link",
      "status": "degraded",
      "metrics": {
        "ts": "2026-03-27T11:59:55+08:00",
        "latency_ms": 16,
        "bandwidth_mbps": 850,
        "utilization_pct": 84,
        "packet_loss_pct": 1.3,
        "jitter_ms": 3.8
      }
    },
    {
      "id": "e-gw-sh-01-edge-sh-01",
      "source": "gw-sh-01",
      "target": "edge-sh-01",
      "relation": "network_link",
      "status": "up",
      "metrics": {
        "ts": "2026-03-27T11:59:55+08:00",
        "latency_ms": 6,
        "bandwidth_mbps": 1800,
        "utilization_pct": 51,
        "packet_loss_pct": 0.03,
        "jitter_ms": 0.6
      }
    },
    {
      "id": "e-edge-sh-01-gw-sh-01",
      "source": "edge-sh-01",
      "target": "gw-sh-01",
      "relation": "network_link",
      "status": "up",
      "metrics": {
        "ts": "2026-03-27T11:59:55+08:00",
        "latency_ms": 5,
        "bandwidth_mbps": 1750,
        "utilization_pct": 46,